{"schemaVersion":"1","messageType":"document.processing.requested","messageId":"11111111-1111-4111-8111-111111111111","documentId":"22222222-2222-4222-8222-222222222222","ownerId":"33333333-3333-4333-8333-333333333333","job":{"jobId":"44444444-4444-4444-8444-444444444444","jobType":"FULL_PIPELINE","attempt":1,"idempotencyKey":"aaaaaaaaaaaaaaaaaaaaaaaaaaaaaaaaaaaaaaaaaaaaaaaaaaaaaaaaaaaaaaaa","leaseId":"55555555-5555-4555-8555-555555555555"},"correlationId":"66666666-6666-4666-8666-666666666666","provider":{"selectionKind":"PLAN","providerIdentity":"bbbbbbbbbbbbbbbbbbbbbbbbbbbbbbbbbbbbbbbbbbbbbbbbbbbbbbbbbbbbbbbb"},"prompt":{"version":"v1","fingerprint":"cccccccccccccccccccccccccccccccccccccccccccccccccccccccccccccccc"},"occurredAt":"2026-08-14T00:00:00Z"}
